{
  "schema_version": "fabric.capture-manifest/v1",
  "manifest_id": "5fab8ca0-6356-4fe0-a6c9-787151825ebe",
  "event_id": "04280d75-669c-46f1-af4a-7a575ba4148e",
  "source_id": "s-760e17e0fc7aa1ec75c5338972cec327",
  "source_epoch": 4611686018427387905,
  "emitted_at": "2026-10-19T09:00:00Z",
  "sdk": {
    "language": "python",
    "version": "0.9.0"
  },
  "runtime": {
    "name": "cpython",
    "version": "3.12.13"
  },
  "profile": "production",
  "coverage_profile": "fabric.profile.model-calls/v1",
  "identity_mode": "pseudonymous",
  "pseudonym_mode": "unkeyed",
  "capture_policy": {
    "policy_id": "acme-capture",
    "policy_version": 3,
    "policy_digest": "sha256:00cc2df0f89efb834c30107eece29801ffc4010e327baab899a300cac58ba923",
    "encrypted_store_required": true
  },
  "content_capture": "disabled",
  "role_table_version": "fabric.content-role-table/v1@3",
  "limits": {
    "max_body_bytes": 33554432,
    "max_retain_bytes": 67108864,
    "max_inflight_bytes": 268435456,
    "queue_max_items": 1024,
    "part_min_bytes": 65536,
    "records_max_object_bytes": 16777216,
    "open_run_deadline_s": 604800
  },
  "sequence_unit": "record",
  "clock": {
    "domain": "wall_utc",
    "uncertainty_ns": 0,
    "max_uncertainty_ns": 300000000000
  },
  "endpoint_set_sha256": "sha256:a37f50d1e944098d12adf45203500f1e9914fe5f6e32f596ce3adc7fea4f1fd4",
  "explicit_wins": true,
  "capture_points": [
    {
      "id": "fabric.self",
      "version": "0.9.0",
      "kind": "F",
      "state": "active",
      "process_global": false,
      "opt_in": false,
      "fields": [
        "X01",
        "X02",
        "X03",
        "X06",
        "X07",
        "X17",
        "X18",
        "X19",
        "X20",
        "X23",
        "X25",
        "X26",
        "X27",
        "X29",
        "X32",
        "X33",
        "X34",
        "X35",
        "X36",
        "X38",
        "X39",
        "X44",
        "X45",
        "X47",
        "C16",
        "S01",
        "S03",
        "S31",
        "D11",
        "D24",
        "D34"
      ]
    },
    {
      "id": "install.config",
      "version": "0.9.0",
      "kind": "R",
      "state": "active",
      "process_global": false,
      "opt_in": false,
      "fields": [
        "X04",
        "X05",
        "X31",
        "C12",
        "C15"
      ]
    },
    {
      "id": "wire.py.httpx",
      "version": "1.2.0",
      "kind": "W",
      "state": "active",
      "process_global": true,
      "opt_in": true,
      "fields": [
        "X08",
        "X22",
        "X24",
        "X40",
        "C34",
        "C35",
        "C37",
        "C40",
        "S07",
        "S08",
        "S09",
        "S10",
        "S11",
        "S29",
        "S30",
        "S32",
        "N01",
        "N02",
        "N07",
        "D31"
      ]
    },
    {
      "id": "explicit.call_recorder",
      "version": "0.9.0",
      "kind": "R",
      "state": "installed_inactive",
      "process_global": false,
      "opt_in": false,
      "fields": [
        "X18",
        "X22",
        "X24",
        "C19",
        "C21",
        "S07",
        "S08",
        "S10",
        "N01",
        "N03",
        "N04",
        "N09",
        "N17",
        "N39"
      ],
      "reason": "not_instrumented"
    },
    {
      "id": "sdk.records",
      "version": "0.9.0",
      "kind": "R",
      "state": "active",
      "process_global": false,
      "opt_in": false,
      "fields": [
        "X13",
        "X14",
        "X15",
        "X16",
        "X21",
        "X22",
        "X24",
        "X28",
        "X46",
        "C01",
        "C02",
        "C03",
        "C04",
        "C05",
        "C06",
        "C07",
        "C08",
        "C09",
        "C10",
        "C11",
        "C13",
        "C14",
        "C15",
        "C17",
        "C18",
        "C24",
        "C30",
        "C31",
        "C32",
        "C33",
        "C41",
        "C42",
        "S02",
        "S03",
        "S04",
        "S05",
        "S06",
        "S07",
        "S08",
        "S09",
        "S10",
        "S12",
        "S13",
        "S14",
        "S15",
        "S16",
        "S17",
        "S18",
        "S19",
        "S20",
        "S21",
        "S22",
        "S23",
        "S24",
        "S25",
        "S26",
        "S27",
        "S28",
        "S32",
        "S33",
        "N13",
        "N14",
        "N17",
        "N18",
        "N26",
        "N27",
        "N28",
        "N30",
        "N31",
        "N38",
        "N45",
        "N46",
        "N48",
        "N49",
        "N50",
        "N51",
        "N54",
        "N55",
        "N57",
        "N58",
        "N59",
        "D01",
        "D02",
        "D03",
        "D04",
        "D05",
        "D06",
        "D07",
        "D08",
        "D09",
        "D10",
        "D12",
        "D13",
        "D14",
        "D15",
        "D16",
        "D18",
        "D19",
        "D20",
        "D21",
        "D22",
        "D23",
        "D25",
        "D26",
        "D27",
        "D28",
        "D29",
        "D30"
      ]
    },
    {
      "id": "run.scope",
      "version": "0.9.0",
      "kind": "R",
      "state": "active",
      "process_global": false,
      "opt_in": false,
      "fields": [
        "X08",
        "X09",
        "X10",
        "X11",
        "X12",
        "X13",
        "X14",
        "X21",
        "X41",
        "X42",
        "X43",
        "X44",
        "X46",
        "S34"
      ]
    },
    {
      "id": "mcp.client",
      "version": "0.9.0",
      "kind": "H",
      "state": "disabled",
      "process_global": true,
      "opt_in": true,
      "fields": [
        "C25",
        "C26",
        "C27",
        "C28",
        "C29",
        "N22",
        "N23",
        "N24",
        "N25"
      ],
      "reason": "hook_disabled"
    },
    {
      "id": "reconstruct.parse",
      "version": "0.9.0",
      "kind": "P",
      "state": "active",
      "process_global": false,
      "opt_in": false,
      "fields": [
        "X27",
        "X28",
        "X30",
        "C11",
        "C19",
        "C20",
        "C21",
        "C22",
        "C36",
        "C37",
        "C38",
        "C39",
        "S01",
        "S03",
        "S11",
        "S12",
        "N03",
        "N04",
        "N05",
        "N06",
        "N07",
        "N08",
        "N09",
        "N10",
        "N11",
        "N12",
        "N13",
        "N14",
        "N15",
        "N18",
        "N19",
        "N20",
        "N21",
        "N51",
        "N53",
        "N55",
        "N60",
        "D31",
        "D32",
        "D33"
      ]
    },
    {
      "id": "reconstruct.infer",
      "version": "0.9.0",
      "kind": "I",
      "state": "active",
      "process_global": false,
      "opt_in": false,
      "fields": [
        "X21",
        "C08",
        "C23",
        "C39",
        "S13",
        "S15",
        "N16",
        "N29",
        "N48",
        "N52",
        "D17"
      ]
    }
  ],
  "uncaptured_classes": [
    "requests",
    "urllib3",
    "boto3",
    "aiohttp",
    "grpc",
    "websocket",
    "non_post_endpoints",
    "unmatched_endpoints"
  ],
  "inputs": [
    "wire",
    "records"
  ],
  "manifest_seq": 0,
  "after_source_sequence": -1,
  "chunk_boundaries_retained": false,
  "spool_encrypted": true,
  "unsealed_prior_epochs": [],
  "unsealed_prior_epoch_count": 0,
  "source_auth": "bound",
  "content_capture_reason": "missing_id_key"
}
