{
  "schema_version": "fabric.capture-manifest/v1",
  "manifest_id": "cff06318-3074-4a06-a1a5-69b575485265",
  "event_id": "1a207bd2-3a16-426f-afec-552d7d478843",
  "source_id": "s-b94f348e8d6890782b2af72c847dc77b",
  "source_epoch": 4611686018427387905,
  "emitted_at": "2026-10-19T09:00:00Z",
  "sdk": {
    "language": "typescript",
    "version": "0.9.0"
  },
  "runtime": {
    "name": "nodejs",
    "version": "24.1.0"
  },
  "profile": "local",
  "coverage_profile": "fabric.profile.model-calls/v1",
  "identity_mode": "pseudonymous",
  "pseudonym_mode": "keyed",
  "key_id": "kid-b2a0080c",
  "content_capture": "metadata_only",
  "role_table_version": "fabric.content-role-table/v1@4",
  "limits": {
    "max_body_bytes": 33554432,
    "max_retain_bytes": 67108864,
    "max_inflight_bytes": 268435456,
    "queue_max_items": 1024,
    "part_min_bytes": 65536,
    "records_max_object_bytes": 16777216,
    "open_run_deadline_s": 604800
  },
  "sequence_unit": "record",
  "clock": {
    "domain": "wall_utc",
    "uncertainty_ns": 0,
    "max_uncertainty_ns": 300000000000
  },
  "endpoint_set_sha256": "sha256:a37f50d1e944098d12adf45203500f1e9914fe5f6e32f596ce3adc7fea4f1fd4",
  "explicit_wins": false,
  "capture_points": [
    {
      "id": "fabric.self",
      "version": "0.9.0",
      "kind": "F",
      "state": "active",
      "process_global": false,
      "opt_in": false,
      "fields": [
        "X01",
        "X02",
        "X03",
        "X06",
        "X07",
        "X17",
        "X18",
        "X19",
        "X20",
        "X23",
        "X25",
        "X26",
        "X27",
        "X29",
        "X32",
        "X33",
        "X34",
        "X35",
        "X36",
        "X38",
        "X39",
        "X44",
        "X45",
        "X47",
        "X48",
        "C16",
        "S01",
        "S03",
        "S31",
        "D11",
        "D24",
        "D34"
      ]
    },
    {
      "id": "wire.ts.undici",
      "version": "0.0.0",
      "kind": "W",
      "state": "unsupported",
      "process_global": true,
      "opt_in": true,
      "fields": [
        "N01"
      ],
      "reason": "unsupported_runtime"
    },
    {
      "id": "sdk.records",
      "version": "0.9.0",
      "kind": "R",
      "state": "failed",
      "process_global": false,
      "opt_in": false,
      "fields": [
        "X13",
        "X14",
        "X15",
        "X16",
        "X21",
        "X22",
        "X24",
        "X28",
        "X46",
        "C01",
        "C02",
        "C03",
        "C04",
        "C05",
        "C06",
        "C07",
        "C08",
        "C09",
        "C10",
        "C11",
        "C13",
        "C14",
        "C15",
        "C17",
        "C18",
        "C24",
        "C30",
        "C31",
        "C32",
        "C33",
        "C41",
        "C42",
        "S02",
        "S03",
        "S04",
        "S05",
        "S06",
        "S07",
        "S08",
        "S09",
        "S10",
        "S12",
        "S13",
        "S14",
        "S15",
        "S16",
        "S17",
        "S18",
        "S19",
        "S20",
        "S21",
        "S22",
        "S23",
        "S24",
        "S25",
        "S26",
        "S27",
        "S28",
        "S32",
        "S33",
        "N13",
        "N14",
        "N17",
        "N18",
        "N26",
        "N27",
        "N28",
        "N30",
        "N31",
        "N38",
        "N45",
        "N46",
        "N48",
        "N49",
        "N50",
        "N51",
        "N54",
        "N55",
        "N57",
        "N58",
        "N59",
        "D01",
        "D02",
        "D03",
        "D04",
        "D05",
        "D06",
        "D07",
        "D08",
        "D09",
        "D10",
        "D12",
        "D13",
        "D14",
        "D15",
        "D16",
        "D18",
        "D19",
        "D20",
        "D21",
        "D22",
        "D23",
        "D25",
        "D26",
        "D27",
        "D28",
        "D29",
        "D30"
      ],
      "reason": "internal_error"
    }
  ],
  "uncaptured_classes": [
    "node_http",
    "axios",
    "custom_fetch",
    "node_below_24",
    "websocket"
  ],
  "inputs": [
    "records"
  ],
  "manifest_seq": 0,
  "after_source_sequence": -1,
  "chunk_boundaries_retained": false,
  "spool_encrypted": false,
  "unsealed_prior_epochs": [],
  "unsealed_prior_epoch_count": 0,
  "source_auth": "unbound",
  "content_capture_reason": "not_configured"
}
